{
  "estimated_no_of_lines": "1,500",
  "human_lines_per_second": 0.0,
  "ai_lines_per_second": 0.36,
  "human_to_ai_ratio_min": 0.01,
  "estimated_ai_time": "1.16 (1.2 hours)",
  "estimated_human_time_min": "109.89 (4.6 days)",
  "estimated_human_time_average": "114.68 (4.8 days)",
  "technologies": {
    "postgres": {
      "estimated_lines_of_code": "1,500",
      "estimated_human_time_min": 109.89,
      "estimated_human_time_min_readable": "4.6 days",
      "estimated_human_time_average": 114.68,
      "estimated_human_time_average_readable": "4.8 days",
      "mentioned_in_prompt": false,
      "recommended_in_standard_system_design": true,
      "contribution_to_lines_of_code": 100.0,
      "complexity_score": 58,
      "complexity_explanation": {
        "difficulty_level": 5.0,
        "reasons": [
          "SQL knowledge required",
          "Complex queries",
          "Indexing strategies",
          "Transaction management"
        ]
      },
      "default_cli_code": "PostgreSQL",
      "difficulty_explanation": {
        "time_to_productivity": "3-6 weeks",
        "learning_curve_factors": [
          "SQL knowledge required",
          "Complex queries",
          "Indexing strategies",
          "Transaction management"
        ]
      }
    }
  },
  "formatted_detailed_string": "## I want someone to create a resume parser for pdf...\n\n### Estimated Effort:\n- **Total Lines of Code**: ~1,500 lines\n- **AI-Assisted Development**: ~1.16 (1.2 hours)\n- **Human Development**:\n  - Minimum: 109.89 (4.6 days)\n  - Average: 114.68 (4.8 days)\n\n### Technology Stack Detected:\n#### Recommended by System Design:\n- **Postgres**\n  - Difficulty: 58/100\n  - Estimated LOC: 1,500 (100.0%)\n  - Setup Time: 4.8 days\n  - Tools: PostgreSQL\n  - Complexity Factors: SQL knowledge required, Complex queries, Indexing strategies\n\n### Key Components:\n- **Data Storage**: Postgres\n\n### Development Timeline:\n- With AI assistance: ~1.16 hours\n- Traditional development: ~4.8 days\n- Speed improvement: ~100x faster with AI\n\n### Potential Challenges:\n- **Postgres**: SQL knowledge required, Complex queries, Indexing strategies, Transaction management"
}