{
  "estimated_no_of_lines": "39,528",
  "human_lines_per_second": 0.0,
  "ai_lines_per_second": 0.36,
  "human_to_ai_ratio_min": 0.01,
  "estimated_ai_time": "30.44 (1.3 days)",
  "estimated_human_time_min": "2895.87 (4.0 months)",
  "estimated_human_time_average": "3021.92 (4.1 months)",
  "technologies": {
    "redis": {
      "estimated_lines_of_code": "1,647",
      "estimated_human_time_min": 120.66,
      "estimated_human_time_min_readable": "5.0 days",
      "estimated_human_time_average": 125.91,
      "estimated_human_time_average_readable": "5.2 days",
      "mentioned_in_prompt": false,
      "recommended_in_standard_system_design": true,
      "contribution_to_lines_of_code": 4.17,
      "complexity_score": 27,
      "complexity_explanation": {
        "difficulty_level": 3.0,
        "reasons": [
          "Simple key-value model",
          "Limited data structures",
          "Easy commands",
          "Caching straightforward"
        ]
      },
      "default_cli_code": "Redis",
      "difficulty_explanation": {
        "time_to_productivity": "1-2 weeks",
        "learning_curve_factors": [
          "Simple key-value model",
          "Limited data structures",
          "Easy commands",
          "Caching straightforward"
        ]
      }
    },
    "mysql": {
      "estimated_lines_of_code": "2,196",
      "estimated_human_time_min": 160.88,
      "estimated_human_time_min_readable": "6.7 days",
      "estimated_human_time_average": 167.88,
      "estimated_human_time_average_readable": "7.0 days",
      "mentioned_in_prompt": false,
      "recommended_in_standard_system_design": true,
      "contribution_to_lines_of_code": 5.56,
      "complexity_score": 40,
      "complexity_explanation": {
        "difficulty_level": 4.0,
        "reasons": [
          "SQL knowledge required",
          "Simpler than Postgres",
          "Less features = easier",
          "Good documentation"
        ]
      },
      "default_cli_code": "MySQL",
      "difficulty_explanation": {
        "time_to_productivity": "2-4 weeks",
        "learning_curve_factors": [
          "SQL knowledge required",
          "Simpler than Postgres",
          "Less features = easier",
          "Good documentation"
        ]
      }
    },
    "postgres": {
      "estimated_lines_of_code": "2,745",
      "estimated_human_time_min": 201.1,
      "estimated_human_time_min_readable": "1.2 weeks",
      "estimated_human_time_average": 209.86,
      "estimated_human_time_average_readable": "1.2 weeks",
      "mentioned_in_prompt": false,
      "recommended_in_standard_system_design": true,
      "contribution_to_lines_of_code": 6.94,
      "complexity_score": 58,
      "complexity_explanation": {
        "difficulty_level": 5.0,
        "reasons": [
          "SQL knowledge required",
          "Complex queries",
          "Indexing strategies",
          "Transaction management"
        ]
      },
      "default_cli_code": "PostgreSQL",
      "difficulty_explanation": {
        "time_to_productivity": "3-6 weeks",
        "learning_curve_factors": [
          "SQL knowledge required",
          "Complex queries",
          "Indexing strategies",
          "Transaction management"
        ]
      }
    },
    "python_fastapi": {
      "estimated_lines_of_code": "9,882",
      "estimated_human_time_min": 723.97,
      "estimated_human_time_min_readable": "4.3 weeks",
      "estimated_human_time_average": 755.48,
      "estimated_human_time_average_readable": "1.0 month",
      "mentioned_in_prompt": false,
      "recommended_in_standard_system_design": true,
      "contribution_to_lines_of_code": 25.0,
      "complexity_score": 40,
      "complexity_explanation": {
        "difficulty_level": 4.0,
        "reasons": [
          "Python simplicity",
          "Type hints helpful",
          "Async concepts",
          "Good documentation"
        ]
      },
      "default_cli_code": "FastAPI",
      "difficulty_explanation": {
        "time_to_productivity": "2-3 weeks",
        "learning_curve_factors": [
          "Python simplicity",
          "Type hints helpful",
          "Async concepts",
          "Good documentation"
        ]
      }
    },
    "node": {
      "estimated_lines_of_code": "9,882",
      "estimated_human_time_min": 723.97,
      "estimated_human_time_min_readable": "4.3 weeks",
      "estimated_human_time_average": 755.48,
      "estimated_human_time_average_readable": "1.0 month",
      "mentioned_in_prompt": false,
      "recommended_in_standard_system_design": true,
      "contribution_to_lines_of_code": 25.0,
      "complexity_score": 40,
      "complexity_explanation": {
        "difficulty_level": 4.0,
        "reasons": [
          "JavaScript familiarity",
          "Async/await learning curve",
          "Callback hell risk",
          "Good ecosystem"
        ]
      },
      "default_cli_code": "Express/Fastify",
      "difficulty_explanation": {
        "time_to_productivity": "2-4 weeks",
        "learning_curve_factors": [
          "JavaScript familiarity",
          "Async/await learning curve",
          "Callback hell risk",
          "Good ecosystem"
        ]
      }
    },
    "vue": {
      "estimated_lines_of_code": "3,294",
      "estimated_human_time_min": 241.32,
      "estimated_human_time_min_readable": "1.4 weeks",
      "estimated_human_time_average": 251.83,
      "estimated_human_time_average_readable": "1.5 weeks",
      "mentioned_in_prompt": false,
      "recommended_in_standard_system_design": true,
      "contribution_to_lines_of_code": 8.33,
      "complexity_score": 27,
      "complexity_explanation": {
        "difficulty_level": 3.0,
        "reasons": [
          "Simpler than React",
          "Intuitive API",
          "Good documentation",
          "Easy template syntax"
        ]
      },
      "default_cli_code": "Vite",
      "difficulty_explanation": {
        "time_to_productivity": "1-2 weeks",
        "learning_curve_factors": [
          "Simpler than React",
          "Intuitive API",
          "Good documentation",
          "Easy template syntax"
        ]
      }
    },
    "react": {
      "estimated_lines_of_code": "4,392",
      "estimated_human_time_min": 321.76,
      "estimated_human_time_min_readable": "1.9 weeks",
      "estimated_human_time_average": 335.77,
      "estimated_human_time_average_readable": "2.0 weeks",
      "mentioned_in_prompt": false,
      "recommended_in_standard_system_design": true,
      "contribution_to_lines_of_code": 11.11,
      "complexity_score": 40,
      "complexity_explanation": {
        "difficulty_level": 4.0,
        "reasons": [
          "Component model easy to grasp",
          "Large ecosystem",
          "Good documentation",
          "JSX syntax learning curve"
        ]
      },
      "default_cli_code": "Vite or Next.js",
      "difficulty_explanation": {
        "time_to_productivity": "2-4 weeks",
        "learning_curve_factors": [
          "Component model easy to grasp",
          "Large ecosystem",
          "Good documentation",
          "JSX syntax learning curve"
        ]
      }
    },
    "nextjs": {
      "estimated_lines_of_code": "5,490",
      "estimated_human_time_min": 402.2,
      "estimated_human_time_min_readable": "2.4 weeks",
      "estimated_human_time_average": 419.71,
      "estimated_human_time_average_readable": "2.5 weeks",
      "mentioned_in_prompt": true,
      "recommended_in_standard_system_design": false,
      "contribution_to_lines_of_code": 13.89,
      "complexity_score": 58,
      "complexity_explanation": {
        "difficulty_level": 5.0,
        "reasons": [
          "Requires React knowledge",
          "SSR/SSG concepts",
          "Routing conventions",
          "Multiple rendering modes"
        ]
      },
      "default_cli_code": "Next.js",
      "difficulty_explanation": {
        "time_to_productivity": "3-5 weeks",
        "learning_curve_factors": [
          "Requires React knowledge",
          "SSR/SSG concepts",
          "Routing conventions",
          "Multiple rendering modes"
        ]
      }
    }
  },
  "formatted_detailed_string": "## Create an e-commerce platform with nextjs, stripe payments, and authentication...\n\n### Estimated Effort:\n- **Total Lines of Code**: ~39,528 lines\n- **AI-Assisted Development**: ~30.44 (1.3 days)\n- **Human Development**:\n  - Minimum: 2895.87 (4.0 months)\n  - Average: 3021.92 (4.1 months)\n\n### Technology Stack Detected:\n#### Mentioned in Requirements:\n- **Nextjs**\n  - Difficulty: 58/100\n  - Estimated LOC: 5,490 (13.89%)\n  - Setup Time: 2.5 weeks\n  - Tools: Next.js\n  - Complexity Factors: Requires React knowledge, SSR/SSG concepts, Routing conventions\n\n#### Recommended by System Design:\n- **Redis**\n  - Difficulty: 27/100\n  - Estimated LOC: 1,647 (4.17%)\n  - Setup Time: 5.2 days\n  - Tools: Redis\n  - Complexity Factors: Simple key-value model, Limited data structures, Easy commands\n\n- **Mysql**\n  - Difficulty: 40/100\n  - Estimated LOC: 2,196 (5.56%)\n  - Setup Time: 7.0 days\n  - Tools: MySQL\n  - Complexity Factors: SQL knowledge required, Simpler than Postgres, Less features = easier\n\n- **Postgres**\n  - Difficulty: 58/100\n  - Estimated LOC: 2,745 (6.94%)\n  - Setup Time: 1.2 weeks\n  - Tools: PostgreSQL\n  - Complexity Factors: SQL knowledge required, Complex queries, Indexing strategies\n\n- **Python Fastapi**\n  - Difficulty: 40/100\n  - Estimated LOC: 9,882 (25.0%)\n  - Setup Time: 1.0 month\n  - Tools: FastAPI\n  - Complexity Factors: Python simplicity, Type hints helpful, Async concepts\n\n- **Node**\n  - Difficulty: 40/100\n  - Estimated LOC: 9,882 (25.0%)\n  - Setup Time: 1.0 month\n  - Tools: Express/Fastify\n  - Complexity Factors: JavaScript familiarity, Async/await learning curve, Callback hell risk\n\n- **Vue**\n  - Difficulty: 27/100\n  - Estimated LOC: 3,294 (8.33%)\n  - Setup Time: 1.5 weeks\n  - Tools: Vite\n  - Complexity Factors: Simpler than React, Intuitive API, Good documentation\n\n- **React**\n  - Difficulty: 40/100\n  - Estimated LOC: 4,392 (11.11%)\n  - Setup Time: 2.0 weeks\n  - Tools: Vite or Next.js\n  - Complexity Factors: Component model easy to grasp, Large ecosystem, Good documentation\n\n### Key Components:\n- **Backend**: Python Fastapi, Node\n- **Data Storage**: Redis, Mysql, Postgres\n- **Frontend**: Vue, React, Nextjs\n\n### Development Timeline:\n- With AI assistance: ~30.44 hours\n- Traditional development: ~4.1 months\n- Speed improvement: ~100x faster with AI\n\n### Potential Challenges:\n- **Postgres**: SQL knowledge required, Complex queries, Indexing strategies, Transaction management\n- **Nextjs**: Requires React knowledge, SSR/SSG concepts, Routing conventions, Multiple rendering modes"
}