{
  "estimated_no_of_lines": "9,734",
  "human_lines_per_second": 0.0,
  "ai_lines_per_second": 0.36,
  "human_to_ai_ratio_min": 0.01,
  "estimated_ai_time": "7.5 (7.5 hours)",
  "estimated_human_time_min": "713.15 (4.2 weeks)",
  "estimated_human_time_average": "744.2 (1.0 month)",
  "technologies": {
    "redis": {
      "estimated_lines_of_code": "608",
      "estimated_human_time_min": 44.54,
      "estimated_human_time_min_readable": "1.9 days",
      "estimated_human_time_average": 46.48,
      "estimated_human_time_average_readable": "1.9 days",
      "mentioned_in_prompt": false,
      "recommended_in_standard_system_design": true,
      "contribution_to_lines_of_code": 6.25,
      "complexity_score": 27,
      "complexity_explanation": {
        "difficulty_level": 3.0,
        "reasons": [
          "Simple key-value model",
          "Limited data structures",
          "Easy commands",
          "Caching straightforward"
        ]
      },
      "default_cli_code": "Redis",
      "difficulty_explanation": {
        "time_to_productivity": "1-2 weeks",
        "learning_curve_factors": [
          "Simple key-value model",
          "Limited data structures",
          "Easy commands",
          "Caching straightforward"
        ]
      }
    },
    "postgres": {
      "estimated_lines_of_code": "1,014",
      "estimated_human_time_min": 74.29,
      "estimated_human_time_min_readable": "3.1 days",
      "estimated_human_time_average": 77.52,
      "estimated_human_time_average_readable": "3.2 days",
      "mentioned_in_prompt": true,
      "recommended_in_standard_system_design": false,
      "contribution_to_lines_of_code": 10.42,
      "complexity_score": 58,
      "complexity_explanation": {
        "difficulty_level": 5.0,
        "reasons": [
          "SQL knowledge required",
          "Complex queries",
          "Indexing strategies",
          "Transaction management"
        ]
      },
      "default_cli_code": "PostgreSQL",
      "difficulty_explanation": {
        "time_to_productivity": "3-6 weeks",
        "learning_curve_factors": [
          "SQL knowledge required",
          "Complex queries",
          "Indexing strategies",
          "Transaction management"
        ]
      }
    },
    "python_fastapi": {
      "estimated_lines_of_code": "2,434",
      "estimated_human_time_min": 178.32,
      "estimated_human_time_min_readable": "1.1 weeks",
      "estimated_human_time_average": 186.09,
      "estimated_human_time_average_readable": "1.1 weeks",
      "mentioned_in_prompt": false,
      "recommended_in_standard_system_design": true,
      "contribution_to_lines_of_code": 25.01,
      "complexity_score": 40,
      "complexity_explanation": {
        "difficulty_level": 4.0,
        "reasons": [
          "Python simplicity",
          "Type hints helpful",
          "Async concepts",
          "Good documentation"
        ]
      },
      "default_cli_code": "FastAPI",
      "difficulty_explanation": {
        "time_to_productivity": "2-3 weeks",
        "learning_curve_factors": [
          "Python simplicity",
          "Type hints helpful",
          "Async concepts",
          "Good documentation"
        ]
      }
    },
    "node": {
      "estimated_lines_of_code": "2,433",
      "estimated_human_time_min": 178.25,
      "estimated_human_time_min_readable": "1.1 weeks",
      "estimated_human_time_average": 186.01,
      "estimated_human_time_average_readable": "1.1 weeks",
      "mentioned_in_prompt": false,
      "recommended_in_standard_system_design": true,
      "contribution_to_lines_of_code": 24.99,
      "complexity_score": 40,
      "complexity_explanation": {
        "difficulty_level": 4.0,
        "reasons": [
          "JavaScript familiarity",
          "Async/await learning curve",
          "Callback hell risk",
          "Good ecosystem"
        ]
      },
      "default_cli_code": "Express/Fastify",
      "difficulty_explanation": {
        "time_to_productivity": "2-4 weeks",
        "learning_curve_factors": [
          "JavaScript familiarity",
          "Async/await learning curve",
          "Callback hell risk",
          "Good ecosystem"
        ]
      }
    },
    "react": {
      "estimated_lines_of_code": "3,245",
      "estimated_human_time_min": 237.74,
      "estimated_human_time_min_readable": "1.4 weeks",
      "estimated_human_time_average": 248.09,
      "estimated_human_time_average_readable": "1.5 weeks",
      "mentioned_in_prompt": true,
      "recommended_in_standard_system_design": false,
      "contribution_to_lines_of_code": 33.34,
      "complexity_score": 40,
      "complexity_explanation": {
        "difficulty_level": 4.0,
        "reasons": [
          "Component model easy to grasp",
          "Large ecosystem",
          "Good documentation",
          "JSX syntax learning curve"
        ]
      },
      "default_cli_code": "Vite or Next.js",
      "difficulty_explanation": {
        "time_to_productivity": "2-4 weeks",
        "learning_curve_factors": [
          "Component model easy to grasp",
          "Large ecosystem",
          "Good documentation",
          "JSX syntax learning curve"
        ]
      }
    }
  },
  "formatted_detailed_string": "## Build a twitter clone with react and postgres\n\n### Estimated Effort:\n- **Total Lines of Code**: ~9,734 lines\n- **AI-Assisted Development**: ~7.5 (7.5 hours)\n- **Human Development**:\n  - Minimum: 713.15 (4.2 weeks)\n  - Average: 744.2 (1.0 month)\n\n### Technology Stack Detected:\n#### Mentioned in Requirements:\n- **Postgres**\n  - Difficulty: 58/100\n  - Estimated LOC: 1,014 (10.42%)\n  - Setup Time: 3.2 days\n  - Tools: PostgreSQL\n  - Complexity Factors: SQL knowledge required, Complex queries, Indexing strategies\n\n- **React**\n  - Difficulty: 40/100\n  - Estimated LOC: 3,245 (33.34%)\n  - Setup Time: 1.5 weeks\n  - Tools: Vite or Next.js\n  - Complexity Factors: Component model easy to grasp, Large ecosystem, Good documentation\n\n#### Recommended by System Design:\n- **Redis**\n  - Difficulty: 27/100\n  - Estimated LOC: 608 (6.25%)\n  - Setup Time: 1.9 days\n  - Tools: Redis\n  - Complexity Factors: Simple key-value model, Limited data structures, Easy commands\n\n- **Python Fastapi**\n  - Difficulty: 40/100\n  - Estimated LOC: 2,434 (25.01%)\n  - Setup Time: 1.1 weeks\n  - Tools: FastAPI\n  - Complexity Factors: Python simplicity, Type hints helpful, Async concepts\n\n- **Node**\n  - Difficulty: 40/100\n  - Estimated LOC: 2,433 (24.99%)\n  - Setup Time: 1.1 weeks\n  - Tools: Express/Fastify\n  - Complexity Factors: JavaScript familiarity, Async/await learning curve, Callback hell risk\n\n### Key Components:\n- **Backend**: Python Fastapi, Node\n- **Data Storage**: Redis, Postgres\n- **Frontend**: React\n\n### Development Timeline:\n- With AI assistance: ~7.5 hours\n- Traditional development: ~1.0 month\n- Speed improvement: ~100x faster with AI\n\n### Potential Challenges:\n- **Postgres**: SQL knowledge required, Complex queries, Indexing strategies, Transaction management"
}